{
  "id": "person_lena_fischer",
  "item_type": "person",
  "title": "Lena Fischer",
  "realm": {
    "id": "household",
    "path": ["root", "household"],
    "sensitivity_floor": "internal"
  },
  "sensitivity": {
    "classification": "internal",
    "inherited": true
  },
  "capabilities": {
    "read": {"enabled": true, "version": "1.0.0"},
    "write": {"enabled": true, "version": "1.0.0"},
    "comment": {"enabled": true, "version": "1.0.0"},
    "manage": {"enabled": true, "version": "1.0.0"},
    "directory.profile": {"enabled": true, "version": "1.0.0"}
  },
  "owner": {
    "id": "user_household",
    "display_name": "Household Operator",
    "email": "household.operator@example.com"
  },
  "created_at": "2025-02-15T10:12:00Z",
  "updated_at": "2025-02-18T08:45:12Z",
  "fields": {
    "profile": {
      "display_name": "Lena Fischer",
      "given_name": "Lena",
      "family_name": "Fischer",
      "pronouns": "she/her",
      "relationship_stage": "active",
      "roles": ["insurance_agent"],
      "affiliations": [
        {
          "organization": "Nordlicht Versicherungen",
          "role": "Account Manager"
        }
      ],
      "review_cadence_days": 365,
      "last_reviewed_at": "2025-01-05T12:00:00Z",
      "next_review_at": "2026-01-05T12:00:00Z"
    },
    "contact_methods": [
      {
        "kind": "email",
        "value": "lena.fischer@nordlicht.example",
        "label": "Work Email",
        "verified": true
      },
      {
        "kind": "phone",
        "value": "+49 30 1234567",
        "label": "Office",
        "verified": true
      }
    ],
    "links": [
      {
        "title": "Nordlicht account workspace",
        "url": "https://portal.nordlicht.example/accounts/lfischer",
        "kind": "reference"
      }
    ],
    "related_items": [
      {
        "object_type": "task",
        "object_id": "task_insurance_followup",
        "uri": "kki://item/task_insurance_followup",
        "relationship": "follow-up"
      },
      {
        "object_type": "document",
        "object_id": "doc_insurance_policy_pdf",
        "uri": "kki://item/doc_insurance_policy_pdf",
        "relationship": "policy-document"
      }
    ],
    "tags": ["insurance", "provider"],
    "notes": {
      "type": "delta",
      "ops": [
        {
          "insert": "Prefers email contact before noon; confirm renewal options during March check-in.\n"
        }
      ]
    }
  },
  "metadata": {
    "sys.source": "manual_entry",
    "cap.directory.profile.last_contact_at": "2025-02-17T09:30:00Z"
  },
  "derived": {
    "contact_method_count": 2,
    "affiliation_count": 1,
    "linked_item_count": 2,
    "has_review_cadence": true,
    "has_last_contact": true
  }
}
