{
  "id": "task_456789",
  "item_type": "task",
  "title": "Migrate analytics pipeline",
  "realm": {
    "id": "eng-data",
    "path": ["global", "engineering", "eng-data"],
    "sensitivity_floor": "internal"
  },
  "sensitivity": {
    "classification": "confidential",
    "inherited": false,
    "override_reason": "Contains production credential rotation steps"
  },
  "capabilities": {
    "tasks.board": {
      "enabled": true,
      "version": "2.0.0",
      "config": {
        "lane": "in_progress"
      }
    }
  },
  "owner": {
    "id": "user_dataops1",
    "display_name": "Morgan Dataops"
  },
  "created_at": "2024-02-01T08:00:00Z",
  "updated_at": "2024-02-03T16:45:10Z",
  "fields": {
    "status": "in_progress",
    "due_at": "2024-02-10T23:59:00Z",
    "assignees": [
      {
        "id": "user_dataops1",
        "display_name": "Morgan Dataops"
      },
      {
        "id": "user_dataops2",
        "display_name": "Eli Observability"
      }
    ],
    "primary_dependency": {
      "object_type": "task",
      "object_id": "task_123123",
      "uri": "kki://item/task_123123",
      "relationship": "depends-on"
    },
    "related_objects": [
      {
        "object_type": "wiki_entry",
        "object_id": "wiki_runbook",
        "uri": "kki://item/wiki_runbook",
        "relationship": "runbook"
      }
    ],
    "checklist": [
      {
        "id": "chk1abcd",
        "label": "Inventory existing jobs",
        "checked": true
      },
      {
        "id": "chk2abcd",
        "label": "Provision new cluster",
        "checked": false
      }
    ]
  },
  "metadata": {
    "sys.priority": "p1",
    "ext.jira.key": "DATA-42"
  },
  "derived": {
    "is_overdue": false,
    "progress_summary": {
      "total": 5,
      "completed": 2,
      "percent_complete": 0.4
    }
  }
}
