{
  "id": "doc_insurance_policy_pdf",
  "item_type": "document",
  "title": "2025 Household Liability Policy",
  "realm": {
    "id": "household",
    "path": ["root", "household"],
    "sensitivity_floor": "internal"
  },
  "sensitivity": {
    "classification": "confidential",
    "inherited": false,
    "override_reason": "Contains personal insurance coverage details"
  },
  "capabilities": {
    "read": {"enabled": true, "version": "1.0.0"},
    "write": {"enabled": true, "version": "1.0.0"},
    "comment": {"enabled": true, "version": "1.0.0"}
  },
  "owner": {
    "id": "user_household",
    "display_name": "Household Operator",
    "email": "household.operator@example.com"
  },
  "created_at": "2025-02-10T18:20:00Z",
  "updated_at": "2025-02-12T09:10:45Z",
  "fields": {
    "file": {
      "binary": {
        "blob_id": "blob_a1b2c3d4e5f6",
        "media_type": "application/pdf",
        "size_bytes": 384212,
        "hash": "sha256:2b38fb6184c0a851b6f3ef6f8f8b89d56798f3c8fdd7f1c6de284a39f0c6e2d7"
      },
      "file_name": "2025-household-liability-policy.pdf",
      "original_uri": "https://files.nordlicht.example/policies/liability-2025.pdf"
    },
    "summary": {
      "type": "delta",
      "ops": [
        {
          "insert": "Scanned PDF of the renewed household liability policy effective March 2025.\n"
        }
      ]
    },
    "tags": ["insurance", "policy", "pdf"],
    "related_items": [
      {
        "object_type": "person",
        "object_id": "person_lena_fischer",
        "uri": "kki://item/person_lena_fischer",
        "relationship": "account-manager"
      },
      {
        "object_type": "task",
        "object_id": "task_insurance_followup",
        "uri": "kki://item/task_insurance_followup",
        "relationship": "follow-up"
      }
    ],
    "links": [
      {
        "title": "Policy portal entry",
        "url": "https://portal.nordlicht.example/policies/household-liability-2025",
        "kind": "source"
      }
    ]
  },
  "metadata": {
    "sys.source": "scan_upload",
    "cap.directory.profile.attachment_role": "policy",
    "ext.nordlicht.record_id": "nl-acc-2025-liability"
  },
  "derived": {
    "file_size_bytes": 384212,
    "checksum_sha256": "sha256:2b38fb6184c0a851b6f3ef6f8f8b89d56798f3c8fdd7f1c6de284a39f0c6e2d7",
    "last_indexed_at": "2025-02-12T09:15:00Z"
  }
}
